{
  "venue_id": "escience2026",
  "venue_name": "IEEE eScience 2026",
  "venue_version": "2026-cfp-brief",
  "target_track": "FAIR, provenance, reproducible eScience, scientific workflows, research cyberinfrastructure, and AI/ML/LLMs in science",
  "submission_type": "full_paper",
  "page_limit": 8,
  "reference_exclusion_policy": "references_excluded",
  "deadline": "2026-05-18/2026-05-19 AoE ambiguity",
  "paper_submission_deadline_raw": "Monday, May 18, 2026 / Tuesday, May 19, 2026 11:59 PM AoE as shown on CFP",
  "requires_human_deadline_verification": true,
  "format": "IEEE 8.5x11 double-column, single-spaced 10-point font",
  "proceedings_policy": "Accepted full papers are published in IEEE conference proceedings.",
  "source_constraints": {
    "cfp_url": "https://www.escience-conference.org/2026/call-for-papers",
    "ieee_author_policy_url": "https://conferences.ieeeauthorcenter.ieee.org/author-ethics/guidelines-and-policies/submission-policies/",
    "last_checked": "2026-05-05",
    "requires_human_policy_verification": true
  },
  "review_mode": "single-blind",
  "ai_use_policy": {
    "ai_text_allowed": true,
    "ai_editing_allowed": true,
    "disclosure_required": true,
    "human_final_authoring_required": true,
    "policy_notes": "IEEE eScience 2026 CFP requires AI-generated content disclosure in acknowledgements, identification of the AI system and affected sections, a brief level-of-use explanation, and author responsibility for submitted content."
  },
  "required_sections": [
    "Title",
    "Abstract",
    "Introduction",
    "Problem and Scope",
    "Requirements for Agent Self-Improvement Evidence",
    "ASIEP Profile and Lifecycle",
    "Agent-native Toolchain",
    "Evidence Bundle and Local Packaging",
    "Evaluation",
    "Cross-standard Mapping",
    "Limitations",
    "Conclusion",
    "Acknowledgements and AI-use disclosure draft"
  ],
  "recommended_sections": [
    "Artifacts and Reproducibility",
    "Threats to Validity"
  ],
  "forbidden_claims": [
    "adopted standard",
    "has external certification",
    "globally resolvable PID",
    "production-ready governance",
    "provides complete privacy protection",
    "full OTel integration",
    "full LangSmith integration",
    "has full RO-Crate certification",
    "achieves benchmark SOTA",
    "legal compliance solution"
  ],
  "required_disclosures": [
    "Draft for human authoring and verification",
    "Human authors must verify and rewrite final prose",
    "AI-use disclosure"
  ],
  "required_positioning": [
    "FAIR evidence object",
    "reproducible agent evidence pipeline",
    "provenance",
    "scientific infrastructure",
    "local evidence package",
    "reusable validator",
    "local fixture",
    "minimal implementation",
    "not external certification"
  ],
  "output_requirements": [
    "paper_v0.3_escience draft",
    "readiness_report.json",
    "submission_checklist.md",
    "author_ai_use_disclosure_draft.md",
    "abstract_200words.md",
    "contribution_box.md",
    "limitations_box.md",
    "reviewer_response_seed.md",
    "page_budget_notes.md"
  ],
  "citation_requirements": [
    "reuse M8 citation keys",
    "no citation_required markers",
    "local metrics must cite repository report rather than external benchmark claims"
  ],
  "readiness_checks": [
    "required_sections_present",
    "forbidden_claims_absent",
    "local_only_limitations_present",
    "ai_use_disclosure_present",
    "claim_registry_has_evidence",
    "citation_claim_map_ready",
    "page_budget_estimated",
    "human_final_authoring_required",
    "deadline_human_verification_required",
    "ieee_ai_disclosure_fields_present"
  ]
}
